{
  "$id": "https://pohunekd.github.io/means-of-compute/contracts/v1/usage-record.schema.json",
  "$schema": "https://json-schema.org/draft/2020-12/schema",
  "title": "UsageRecord",
  "description": "Ledger entry for one finished task: tokens per provider and model, session time per host, outcome.",
  "type": "object",
  "additionalProperties": false,
  "required": [
    "schemaVersion",
    "workItemId",
    "finishedAt",
    "tokens",
    "sessionSeconds",
    "attempts",
    "retries",
    "humanInterventions",
    "result"
  ],
  "properties": {
    "schemaVersion": { "const": "v1" },
    "workItemId": { "type": "string", "pattern": "^[a-z0-9][a-z0-9-]{0,62}$" },
    "finishedAt": { "type": "string", "format": "date-time", "pattern": "Z$" },
    "tokens": {
      "type": "array",
      "minItems": 1,
      "items": {
        "type": "object",
        "additionalProperties": false,
        "required": ["provider", "model", "inputTokens", "outputTokens", "requests", "source"],
        "properties": {
          "provider": { "type": "string", "minLength": 1 },
          "model": { "type": "string", "minLength": 1 },
          "inputTokens": { "type": ["integer", "null"], "minimum": 0 },
          "outputTokens": { "type": ["integer", "null"], "minimum": 0 },
          "requests": { "type": "integer", "minimum": 0 },
          "source": { "type": "string", "minLength": 1 }
        }
      }
    },
    "sessionSeconds": {
      "type": "array",
      "minItems": 1,
      "items": {
        "type": "object",
        "additionalProperties": false,
        "required": ["hostAlias", "seconds", "source"],
        "properties": {
          "hostAlias": { "type": "string", "pattern": "^[a-z][a-z0-9-]{0,31}$" },
          "seconds": { "type": "integer", "minimum": 0 },
          "source": { "type": "string", "minLength": 1 }
        }
      }
    },
    "attempts": {
      "type": "array",
      "minItems": 1,
      "items": {
        "type": "object",
        "additionalProperties": false,
        "required": ["model", "result"],
        "properties": {
          "model": { "type": "string", "minLength": 1 },
          "result": { "enum": ["success", "failure", "stalled", "lost"] }
        }
      }
    },
    "retries": { "type": "integer", "minimum": 0 },
    "humanInterventions": { "type": "integer", "minimum": 0 },
    "result": { "enum": ["success", "blocked"] }
  }
}
