{
  "schemaVersion": "v1",
  "workItemId": "w1-contracts",
  "finishedAt": "2026-10-26T10:45:00.000Z",
  "tokens": [
    {
      "provider": "nvidia-build",
      "model": "muse-glimmer-1.3",
      "inputTokens": 12000,
      "outputTokens": 3400,
      "requests": 14,
      "source": "provider-usage"
    },
    {
      "provider": "meta-api",
      "model": "muse-spark-1.3-contributor",
      "inputTokens": 800,
      "outputTokens": 210,
      "requests": 2,
      "source": "provider-usage"
    }
  ],
  "sessionSeconds": [{ "hostAlias": "desktop", "seconds": 540, "source": "dispatcher-clock" }],
  "attempts": [
    { "model": "muse-glimmer-1.3", "result": "failure" },
    { "model": "muse-spark-1.3-contributor", "result": "success" }
  ],
  "retries": 1,
  "humanInterventions": 0,
  "result": "success"
}
